{
  "schemaVersion": "1.1.0",
  "defaultLocale": "en",
  "beliefModes": [
    "just_flower",
    "western_zodiac",
    "tarot",
    "almanac",
    "omikuji",
    "runes",
    "ogham"
  ],
  "entries": [
    {
      "id": "chrysanthemum",
      "flower": {
        "scientificName": "Chrysanthemum × morifolium",
        "tags": ["autumn", "cut_flower", "potted"]
      },
      "locales": {
        "en": {
          "name": "Chrysanthemum",
          "aliases": ["Mum"],
          "care": {
            "light": "Bright light; morning sun is ideal.",
            "water": "Keep evenly moist; avoid soggy soil.",
            "temperature": "Prefers cool-to-mild temps; protect from heat spikes.",
            "petSafety": "Toxic to cats/dogs if ingested."
          },
          "culturalNotesByRegion": {
            "US": "Common in fall decor and bouquets.",
            "CN": "Associated with autumn and resilience."
          }
        },
        "zh": {
          "name": "菊花",
          "aliases": ["秋菊"],
          "care": {
            "light": "喜明亮光照，早晨日照更佳。",
            "water": "保持土壤微湿，避免积水。",
            "temperature": "喜凉爽，注意避免高温暴晒。",
            "petSafety": "猫狗误食可能中毒。"
          },
          "culturalNotesByRegion": {
            "CN": "常被视为清雅、坚韧与秋意的象征。"
          }
        }
      },
      "belief": {
        "just_flower": {
          "locales": {
            "en": {
              "meaningKeywords": ["steadiness", "clarity", "boundaries"],
              "symbolism": "A quiet reminder that consistency beats intensity. Choose one small thing to do well today, then let the rest be simple.",
              "appreciation": "Notice one color in the petals. Breathe in for 4 counts, out for 6. Write one sentence: “Today I will keep it steady by…”"
            },
            "zh": {
              "meaningKeywords": ["沉稳", "清明", "分寸"],
              "symbolism": "提醒你：稳定胜过用力。今天只把一件小事做好，其他就让它们简单一点。",
              "appreciation": "观察花瓣里的一个颜色。吸气4拍、呼气6拍。写一句话：“今天我会用___来保持稳定。”"
            }
          }
        },
        "almanac": {
          "locales": {
            "en": {
              "meaningKeywords": ["seasonality", "discipline", "respect"],
              "symbolism": "Almanac mode: it’s a good day to respect cycles — rest when it’s time to rest, and act cleanly when it’s time to act.",
              "appreciation": "Do one tidy-up pass (60 seconds). Stop as soon as the timer ends."
            },
            "zh": {
              "meaningKeywords": ["节律", "自律", "敬畏"],
              "symbolism": "黄历模式：今天适合尊重节律——该休息就休息，该行动就干净利落。",
              "appreciation": "做一次60秒的快速整理。时间到就停。"
            }
          }
        },
        "omikuji": {
          "locales": {
            "en": {
              "meaningKeywords": ["autumn", "simplicity", "grace"],
              "symbolism": "In many East Asian traditions, chrysanthemum carries an autumnal elegance: beauty that doesn’t rush.",
              "appreciation": "Make tea or warm water. Take three mindful sips and name three things that feel “enough” today."
            },
            "zh": {
              "meaningKeywords": ["秋意", "简淡", "清雅"],
              "symbolism": "在一些东方传统里，菊花有清雅的秋意：不急不躁的美。",
              "appreciation": "泡一杯茶或温水。慢慢喝三口，并说出三件“已经足够”的事。"
            }
          }
        },
        "western_zodiac": {
          "locales": {
            "en": {
              "meaningKeywords": ["steadiness", "clarity", "boundaries"],
              "symbolism": "A quiet reminder that consistency beats intensity. Choose one small thing to do well today, then let the rest be simple.",
              "appreciation": "Notice one color in the petals. Breathe in for 4 counts, out for 6. Write one sentence: “Today I will keep it steady by…”"
            },
            "zh": {
              "meaningKeywords": ["沉稳", "清明", "分寸"],
              "symbolism": "提醒你：稳定胜过用力。今天只把一件小事做好，其他就让它们简单一点。",
              "appreciation": "观察花瓣里的一个颜色。吸气4拍、呼气6拍。写一句话：“今天我会用___来保持稳定。”"
            }
          }
        },
        "tarot": {
          "locales": {
            "en": {
              "meaningKeywords": ["steadiness", "clarity", "boundaries"],
              "symbolism": "A quiet reminder that consistency beats intensity. Choose one small thing to do well today, then let the rest be simple.",
              "appreciation": "Notice one color in the petals. Breathe in for 4 counts, out for 6. Write one sentence: “Today I will keep it steady by…”"
            },
            "zh": {
              "meaningKeywords": ["沉稳", "清明", "分寸"],
              "symbolism": "提醒你：稳定胜过用力。今天只把一件小事做好，其他就让它们简单一点。",
              "appreciation": "观察花瓣里的一个颜色。吸气4拍、呼气6拍。写一句话：“今天我会用___来保持稳定。”"
            }
          }
        },
        "runes": {
          "locales": {
            "en": {
              "meaningKeywords": ["steadiness", "clarity", "boundaries"],
              "symbolism": "A quiet reminder that consistency beats intensity. Choose one small thing to do well today, then let the rest be simple.",
              "appreciation": "Notice one color in the petals. Breathe in for 4 counts, out for 6. Write one sentence: “Today I will keep it steady by…”"
            },
            "zh": {
              "meaningKeywords": ["沉稳", "清明", "分寸"],
              "symbolism": "提醒你：稳定胜过用力。今天只把一件小事做好，其他就让它们简单一点。",
              "appreciation": "观察花瓣里的一个颜色。吸气4拍、呼气6拍。写一句话：“今天我会用___来保持稳定。”"
            }
          }
        },
        "ogham": {
          "locales": {
            "en": {
              "meaningKeywords": ["steadiness", "clarity", "boundaries"],
              "symbolism": "A quiet reminder that consistency beats intensity. Choose one small thing to do well today, then let the rest be simple.",
              "appreciation": "Notice one color in the petals. Breathe in for 4 counts, out for 6. Write one sentence: “Today I will keep it steady by…”"
            },
            "zh": {
              "meaningKeywords": ["沉稳", "清明", "分寸"],
              "symbolism": "提醒你：稳定胜过用力。今天只把一件小事做好，其他就让它们简单一点。",
              "appreciation": "观察花瓣里的一个颜色。吸气4拍、呼气6拍。写一句话：“今天我会用___来保持稳定。”"
            }
          }
        }
      }
    },
    {
      "id": "lotus",
      "flower": { "scientificName": "Nelumbo nucifera", "tags": ["aquatic"] },
      "locales": {
        "en": {
          "name": "Lotus",
          "care": {
            "light": "Full sun for best blooms.",
            "water": "Grows in water; keep submerged in a suitable container/pond.",
            "temperature": "Warm season plant; growth slows in cool weather.",
            "petSafety": "Generally considered non-toxic."
          }
        },
        "zh": {
          "name": "莲花",
          "care": {
            "light": "全日照更易开花。",
            "water": "水生植物，保持在适合的容器或池塘中。",
            "temperature": "喜温暖，天气转凉会减缓生长。",
            "petSafety": "通常认为无毒。"
          }
        }
      },
      "belief": {
        "just_flower": {
          "locales": {
            "en": {
              "meaningKeywords": ["renewal", "focus", "calm"],
              "symbolism": "Lotus is a lesson in clean beginnings: keep your attention on what you can do next, not where you started.",
              "appreciation": "Wash your hands slowly. As the water runs, pick one thought to release and one intention to keep."
            },
            "zh": {
              "meaningKeywords": ["新生", "专注", "安定"],
              "symbolism": "莲花像是在说：起点不重要，下一步更重要。把注意力放在当下能做的事上。",
              "appreciation": "慢慢洗手。水流过时，放下一个念头，留下一个意图。"
            }
          }
        },
        "almanac": {
          "locales": {
            "en": {
              "meaningKeywords": ["patience", "inner_strength", "timing"],
              "symbolism": "Almanac mode: the best growth happens in seasons. Today, do the part that belongs to you and let timing do the rest.",
              "appreciation": "Choose one “seed action” that takes under 2 minutes. Do it now, then stop."
            },
            "zh": {
              "meaningKeywords": ["耐心", "内在力量", "时机"],
              "symbolism": "黄历模式：成长有它的季节。今天只做你该做的那一部分，其他交给时机。",
              "appreciation": "选一个不超过2分钟的“播种动作”，立刻完成，然后就停。"
            }
          }
        },
        "omikuji": {
          "locales": {
            "en": {
              "meaningKeywords": ["stillness", "water", "renewal"],
              "symbolism": "Omikuji mode: let today be a small reset — not dramatic, just clean.",
              "appreciation": "Rinse a cup or bowl, then drink water slowly. With each sip, name one thing you can start fresh."
            },
            "zh": {
              "meaningKeywords": ["静", "水", "更新"],
              "symbolism": "御神签模式：今天适合做一次小小的重启——不必轰烈，只要干净。",
              "appreciation": "冲洗一个杯子或碗，再慢慢喝水。每一口都说出一件可以重新开始的事。"
            }
          }
        },
        "western_zodiac": {
          "locales": {
            "en": {
              "meaningKeywords": ["renewal", "focus", "calm"],
              "symbolism": "Lotus is a lesson in clean beginnings: keep your attention on what you can do next, not where you started.",
              "appreciation": "Wash your hands slowly. As the water runs, pick one thought to release and one intention to keep."
            },
            "zh": {
              "meaningKeywords": ["新生", "专注", "安定"],
              "symbolism": "莲花像是在说：起点不重要，下一步更重要。把注意力放在当下能做的事上。",
              "appreciation": "慢慢洗手。水流过时，放下一个念头，留下一个意图。"
            }
          }
        },
        "tarot": {
          "locales": {
            "en": {
              "meaningKeywords": ["renewal", "focus", "calm"],
              "symbolism": "Lotus is a lesson in clean beginnings: keep your attention on what you can do next, not where you started.",
              "appreciation": "Wash your hands slowly. As the water runs, pick one thought to release and one intention to keep."
            },
            "zh": {
              "meaningKeywords": ["新生", "专注", "安定"],
              "symbolism": "莲花像是在说：起点不重要，下一步更重要。把注意力放在当下能做的事上。",